{
  "$schema": "https://json-schema.org/draft/2020-12/schema",
  "$id": "urn:hint:local:evals:v1:episode",
  "title": "HINT local episode candidate",
  "description": "An evidence-backed proposal of one unit of work. Observed boundaries and inferred boundaries stay apart; an ambiguous link stays unresolved.",
  "type": "object",
  "additionalProperties": false,
  "properties": {
    "record": {
      "const": "episode"
    },
    "manifest_version": {
      "const": 1
    },
    "episode_id": {
      "$ref": "urn:hint:local:evals:v1:common#/$defs/EpisodeID",
      "x-hint-class": "local"
    },
    "created_at": {
      "$ref": "urn:hint:local:evals:v1:common#/$defs/Timestamp",
      "x-hint-class": "local"
    },
    "rules_version": {
      "type": "string",
      "pattern": "^[0-9]+\\.[0-9]+\\.[0-9]+$",
      "x-hint-class": "local"
    },
    "sources": {
      "type": "array",
      "minItems": 1,
      "x-hint-class": "sensitive",
      "items": {
        "type": "object",
        "additionalProperties": false,
        "properties": {
          "agent": {
            "$ref": "urn:hint:local:evals:v1:common#/$defs/Agent"
          },
          "agent_version": {
            "type": "string",
            "minLength": 1,
            "maxLength": 64
          },
          "parser_version": {
            "type": "string",
            "pattern": "^[0-9]+\\.[0-9]+\\.[0-9]+$"
          },
          "source": {
            "$ref": "urn:hint:local:evals:v1:common#/$defs/Digest"
          },
          "session": {
            "type": "string",
            "minLength": 1,
            "maxLength": 200
          },
          "role": {
            "type": "string",
            "enum": [
              "primary",
              "continuation",
              "child"
            ]
          }
        },
        "required": [
          "agent",
          "parser_version",
          "source",
          "session",
          "role"
        ]
      }
    },
    "boundary": {
      "type": "object",
      "additionalProperties": false,
      "x-hint-class": "local",
      "properties": {
        "basis": {
          "type": "string",
          "enum": [
            "observed",
            "inferred"
          ],
          "description": "observed: an explicit task identity or link; inferred: rules or a local model proposed it."
        },
        "start": {
          "$ref": "urn:hint:local:evals:v1:common#/$defs/SourceLocation"
        },
        "end": {
          "$ref": "urn:hint:local:evals:v1:common#/$defs/SourceLocation"
        },
        "rule": {
          "type": "string",
          "minLength": 1,
          "maxLength": 64
        },
        "support": {
          "type": "string",
          "enum": [
            "high",
            "medium",
            "low"
          ],
          "description": "A rule label, not a calibrated probability."
        }
      },
      "required": [
        "basis",
        "start",
        "rule",
        "support"
      ]
    },
    "requests": {
      "type": "array",
      "items": {
        "$ref": "#/$defs/Evidence"
      },
      "minItems": 1,
      "x-hint-class": "sensitive"
    },
    "corrections": {
      "type": "array",
      "items": {
        "$ref": "#/$defs/Evidence"
      },
      "x-hint-class": "sensitive"
    },
    "outcomes": {
      "type": "array",
      "items": {
        "$ref": "#/$defs/Evidence"
      },
      "x-hint-class": "sensitive"
    },
    "repositories": {
      "type": "array",
      "x-hint-class": "sensitive",
      "items": {
        "type": "object",
        "additionalProperties": false,
        "properties": {
          "repo": {
            "type": "string",
            "minLength": 1,
            "maxLength": 200,
            "description": "Name of the repository in the project configuration."
          },
          "base_tree": {
            "$ref": "urn:hint:local:evals:v1:common#/$defs/Digest"
          },
          "result_tree": {
            "$ref": "urn:hint:local:evals:v1:common#/$defs/Digest"
          },
          "base_evidence": {
            "type": "string",
            "enum": [
              "prospective_capture",
              "agent_snapshot",
              "commit",
              "unavailable"
            ]
          },
          "files": {
            "type": "integer",
            "minimum": 0
          },
          "edited": {
            "type": "array",
            "items": {
              "type": "string",
              "minLength": 1,
              "maxLength": 4096
            },
            "maxItems": 10000,
            "uniqueItems": true,
            "description": "Paths that the episode edited, relative to the repository root (sensitive: file names)."
          }
        },
        "required": [
          "repo",
          "base_evidence"
        ]
      }
    },
    "links": {
      "type": "array",
      "x-hint-class": "local",
      "items": {
        "type": "object",
        "additionalProperties": false,
        "properties": {
          "kind": {
            "type": "string",
            "enum": [
              "continues",
              "child_of",
              "depends_on",
              "alternative_of",
              "duplicate_of"
            ]
          },
          "episode_id": {
            "$ref": "urn:hint:local:evals:v1:common#/$defs/EpisodeID"
          },
          "status": {
            "type": "string",
            "enum": [
              "observed",
              "inferred",
              "unresolved"
            ]
          }
        },
        "required": [
          "kind",
          "episode_id",
          "status"
        ]
      }
    },
    "attribution": {
      "type": "string",
      "enum": [
        "exclusive",
        "separated",
        "ambiguous"
      ],
      "x-hint-class": "local"
    },
    "family": {
      "$ref": "urn:hint:local:evals:v1:common#/$defs/Family",
      "x-hint-class": "reportable"
    },
    "reasons": {
      "type": "array",
      "items": {
        "$ref": "urn:hint:local:evals:v1:common#/$defs/Reason"
      },
      "uniqueItems": true,
      "x-hint-class": "local"
    },
    "usage": {
      "type": "object",
      "additionalProperties": false,
      "x-hint-class": "reportable",
      "properties": {
        "requests": {
          "$ref": "urn:hint:local:evals:v1:common#/$defs/Count"
        },
        "input_tokens": {
          "$ref": "urn:hint:local:evals:v1:common#/$defs/Count"
        },
        "output_tokens": {
          "$ref": "urn:hint:local:evals:v1:common#/$defs/Count"
        },
        "child_sessions": {
          "$ref": "urn:hint:local:evals:v1:common#/$defs/Count"
        }
      }
    },
    "generator": {
      "type": "object",
      "additionalProperties": false,
      "x-hint-class": "local",
      "description": "Provenance of a local model segmentation (reason model_segmented): a proposal, never an observation.",
      "properties": {
        "name": {
          "type": "string",
          "maxLength": 100
        },
        "version": {
          "type": "string",
          "maxLength": 64
        },
        "model": {
          "type": "string",
          "maxLength": 200
        },
        "inputs": {
          "type": "array",
          "items": {
            "$ref": "urn:hint:local:evals:v1:common#/$defs/Digest"
          }
        },
        "output": {
          "$ref": "urn:hint:local:evals:v1:common#/$defs/Digest"
        },
        "requests": {
          "type": "integer",
          "minimum": 0
        }
      },
      "required": [
        "name",
        "version",
        "inputs",
        "output",
        "requests"
      ]
    }
  },
  "required": [
    "record",
    "manifest_version",
    "episode_id",
    "created_at",
    "rules_version",
    "sources",
    "boundary",
    "requests",
    "repositories",
    "attribution",
    "reasons"
  ],
  "$defs": {
    "Evidence": {
      "type": "object",
      "additionalProperties": false,
      "properties": {
        "at": {
          "$ref": "urn:hint:local:evals:v1:common#/$defs/SourceLocation"
        },
        "text": {
          "$ref": "urn:hint:local:evals:v1:common#/$defs/Digest",
          "description": "Stored text object; text never sits in the manifest."
        }
      },
      "required": [
        "at"
      ]
    }
  }
}
